{
    "template_path": ["target/generated-templates/org/openprovenance/prov/templates/generic", "src/main/resources/meta/metatemplates"],
    "bindings_path": ["src/main/resources/meta/ptmbindings"],
    "output_dir": "generated-templates/org/openprovenance/prov/templates/ptm",

    "variableMaps": ["./common-ns.json"],

    "tasks": [
        {
            "type": "expansion",
            "input": "parallel2.provn",
            "output": "ptm-expanding",
            "bindings": "ptm-expanding.json",
            "formats": ["provn", "png"],
            "hasProvenance": "prov-ptm-expanding.prov-csv"

        },
        {
            "type": "expansion",
            "input": "parallel2.provn",
            "output": "ptm-mexpanding",
            "bindings": "ptm-mexpanding.json",
            "formats": ["provn", "png"],
            "hasProvenance": "prov-ptm-mexpanding.prov-csv"

        }
    ]
}


